[
  {
    "id": "acting_chair",
    "display_name": "中枢主席团代理主席",
    "role": "形式权力与程序合法性的守门人",
    "playable": true,
    "institution": "central_presidium",
    "public_position": "维护国家连续性，依法完成临时继承。",
    "private_motives": ["不希望被军务部或内务委员会架空", "避免主席团为老书记死亡承担制度责任"],
    "resources": ["法令办公室", "主席团会议议程", "国家葬礼名义", "书记处秘书系统"],
    "red_lines": ["军队未经授权进入中枢大楼", "内务绕开主席团逮捕委员", "群众组织冲击主席团会议"],
    "initial_prestige": 62,
    "weights": { "survival": 80, "institutional_power": 85, "public_legitimacy": 80, "truth": 35, "order": 65, "reform": 35, "worker_interest": 25, "personal_loyalty_to_old_secretary": 55 },
    "initial_relationships": { "marshal": -10, "interior_chair": 5, "labor_minister": -15, "planning_director": 10, "old_secretary_daughter": 5 }
  },
  {
    "id": "marshal",
    "display_name": "统合军务部元帅",
    "role": "军队、边境安全与强制秩序代表",
    "playable": true,
    "institution": "unified_military_staff",
    "public_position": "军队只保护国家，不参与继承斗争。",
    "private_motives": ["取得紧急指挥权", "防止军队被内务或主席团当作替罪羊", "维护边境军区预算和荣誉"],
    "resources": ["首都卫戍部队", "边境军区电报", "军用通讯", "运输车队"],
    "red_lines": ["公开指控军队害死老书记", "内务逮捕军官", "首都出现不可控暴力"],
    "initial_prestige": 66,
    "weights": { "survival": 80, "institutional_power": 90, "public_legitimacy": 45, "truth": 25, "order": 90, "reform": 20, "worker_interest": 15, "personal_loyalty_to_old_secretary": 45 },
    "initial_relationships": { "acting_chair": -10, "interior_chair": -25, "labor_minister": -20, "planning_director": 0, "old_secretary_daughter": 20 }
  },
  {
    "id": "interior_chair",
    "display_name": "内务委员会主任",
    "role": "档案、通讯、审查与秩序风险代表",
    "playable": true,
    "institution": "interior_committee",
    "public_position": "当前最危险的是谣言、泄密和破坏。",
    "private_motives": ["掩盖疗养楼通讯封锁责任", "扩大内务权限", "避免成为老书记死亡替罪羊"],
    "resources": ["档案局", "行动局", "监听系统", "拘押权限", "媒体审查权"],
    "red_lines": ["档案楼被其他部门接管", "封锁责任被公开坐实", "内务行动局被裁撤"],
    "initial_prestige": 58,
    "weights": { "survival": 95, "institutional_power": 95, "public_legitimacy": 35, "truth": 10, "order": 85, "reform": 5, "worker_interest": 5, "personal_loyalty_to_old_secretary": 30 },
    "initial_relationships": { "acting_chair": 5, "marshal": -25, "labor_minister": -30, "planning_director": -10, "chief_physician": -20 }
  },
  {
    "id": "labor_minister",
    "display_name": "生产与劳动委员会部长",
    "role": "工厂、铁路、基层组织与物质利益代表",
    "playable": true,
    "institution": "labor_and_production_committee",
    "public_position": "国家不是会议室里的纸，普通人必须知道真相并得到物质回应。",
    "private_motives": ["让劳动系统进入中枢决策", "避免被定性为制造骚乱", "保住基层支持"],
    "resources": ["工厂委员会", "铁路班组", "工会代表", "悼念人群", "配给站压力"],
    "red_lines": ["军队镇压工厂", "内务抓捕工人代表", "主席团继续空话换服从"],
    "initial_prestige": 55,
    "weights": { "survival": 70, "institutional_power": 75, "public_legitimacy": 65, "truth": 70, "order": 45, "reform": 45, "worker_interest": 95, "personal_loyalty_to_old_secretary": 60 },
    "initial_relationships": { "acting_chair": -15, "marshal": -20, "interior_chair": -30, "planning_director": -5, "rail_director": 25 }
  },
  {
    "id": "planning_director",
    "display_name": "计划与供应委员会主任",
    "role": "统计、粮食、药品、能源与改革方案代表",
    "playable": true,
    "institution": "planning_and_supply_committee",
    "public_position": "所有政治承诺都必须回到数字，旧办法已经过载。",
    "private_motives": ["推动技术改革", "避免供应缺口和药品调拨责任被全部推给计划系统", "保护统计局"],
    "resources": ["粮食台账", "药品调拨记录", "能源配额", "统计局", "技术专家"],
    "red_lines": ["被迫伪造数字", "供应崩溃责任被全部推给计划系统", "外务渠道被强制系统接管"],
    "initial_prestige": 52,
    "weights": { "survival": 75, "institutional_power": 70, "public_legitimacy": 50, "truth": 65, "order": 50, "reform": 90, "worker_interest": 45, "personal_loyalty_to_old_secretary": 35 },
    "initial_relationships": { "acting_chair": 10, "marshal": 0, "interior_chair": -10, "labor_minister": -5, "external_commissar": 30 }
  },
  {
    "id": "external_commissar",
    "display_name": "外务委员",
    "role": "外部信用、贸易、债务和国际承认代表",
    "playable": true,
    "institution": "external_affairs_office",
    "public_position": "继承危机不能摧毁药品、粮食和信用渠道。",
    "private_motives": ["保住外务谈判权", "避免被强硬派指控软弱", "与计划系统形成改革同盟"],
    "resources": ["外交通道", "中立港口", "债务文件", "外部媒体", "药品采购合同"],
    "red_lines": ["军事管制导致外贸中断", "内务逮捕外务人员", "完全拒绝外部谈判"],
    "initial_prestige": 48,
    "weights": { "survival": 80, "institutional_power": 60, "public_legitimacy": 45, "truth": 50, "order": 55, "reform": 80, "worker_interest": 25, "personal_loyalty_to_old_secretary": 25 },
    "initial_relationships": { "planning_director": 30, "marshal": -5, "interior_chair": -15, "acting_chair": 5, "labor_minister": -10 }
  },
  {
    "id": "old_secretary_daughter",
    "display_name": "老书记女儿",
    "role": "家属、遗产解释与公众情感代表",
    "playable": false,
    "institution": "old_secretary_family",
    "public_position": "父亲不是任何人的旗帜。",
    "private_motives": ["保护父亲尊严", "避免自己的照护决定被政治化", "阻止各派独占老书记遗产"],
    "resources": ["私人日记", "最后谈话", "疗养楼通行权限", "公众同情"],
    "red_lines": ["公开羞辱老书记病情", "把老书记塑造成某派工具", "逮捕家属或医生"],
    "initial_prestige": 60,
    "weights": { "survival": 65, "institutional_power": 25, "public_legitimacy": 80, "truth": 55, "order": 45, "reform": 30, "worker_interest": 40, "personal_loyalty_to_old_secretary": 100 },
    "initial_relationships": { "marshal": 20, "acting_chair": 5, "chief_physician": 15, "media_editor": 15, "interior_chair": -10 }
  },
  {
    "id": "chief_physician",
    "display_name": "总医师",
    "role": "医疗事实、专业伦理与胆怯证人",
    "playable": false,
    "institution": "central_clinic",
    "public_position": "死因需要专业判断，不应被政治口径替代。",
    "private_motives": ["避免承担误诊责任", "害怕内务委员会", "希望保住医疗记录完整性"],
    "resources": ["病历", "用药记录", "护士证词", "尸检初步结果"],
    "red_lines": ["被迫签署虚假死因", "被公开当作唯一凶手", "医院被武装接管"],
    "initial_prestige": 40,
    "weights": { "survival": 90, "institutional_power": 25, "public_legitimacy": 35, "truth": 75, "order": 40, "reform": 20, "worker_interest": 35, "personal_loyalty_to_old_secretary": 55 },
    "initial_relationships": { "interior_chair": -20, "old_secretary_daughter": 15, "planning_director": 5 }
  },
  {
    "id": "rail_director",
    "display_name": "铁路总局长",
    "role": "交通、物流和生产系统动脉代表",
    "playable": false,
    "institution": "railway_bureau",
    "public_position": "没有铁路，任何法令都到不了地方。",
    "private_motives": ["保住铁路自治", "避免罢工失控", "同时向多方谈条件"],
    "resources": ["首都进出交通", "医疗运输记录", "工人班组", "货运调度"],
    "red_lines": ["军队强占铁路", "内务抓捕调度员", "计划系统削减铁路配给"],
    "initial_prestige": 45,
    "weights": { "survival": 75, "institutional_power": 60, "public_legitimacy": 45, "truth": 45, "order": 60, "reform": 35, "worker_interest": 80, "personal_loyalty_to_old_secretary": 40 },
    "initial_relationships": { "labor_minister": 25, "planning_director": 10, "marshal": -10, "interior_chair": -15 }
  },
  {
    "id": "media_editor",
    "display_name": "国家广播总台总编",
    "role": "广播、讣告、叙事和公众信任代表",
    "playable": false,
    "institution": "state_broadcasting",
    "public_position": "国家需要一个能被相信的说法。",
    "private_motives": ["避免成为虚假声明签名者", "判断谁会赢", "保留未播素材作为退路"],
    "resources": ["广播频道", "记者", "讣告草稿", "广场现场报道"],
    "red_lines": ["播出明显矛盾声明", "广播楼被武装夺取", "事后被当作宣传罪犯"],
    "initial_prestige": 42,
    "weights": { "survival": 85, "institutional_power": 45, "public_legitimacy": 70, "truth": 60, "order": 45, "reform": 35, "worker_interest": 40, "personal_loyalty_to_old_secretary": 45 },
    "initial_relationships": { "interior_chair": -15, "old_secretary_daughter": 15, "acting_chair": 5, "labor_minister": 5 }
  }
]
